{
  "schema_version": "1.0.0",
  "event_id": "PD_EVT_20260321T000000Z_0001_release_readiness_computed",
  "seq": 1,
  "created_at": "2026-03-21T00:00:00Z",
  "type": "release_readiness_computed",
  "actor": "system",
  "function_id": null,
  "payload": {
    "ready_for_commit": "NOT_READY",
    "blocking_functions": 1,
    "reason": "High-priority functions are not accepted yet."
  },
  "snapshot_ref": "PD_STATE_20260321T000000Z_0000000.json",
  "supersedes": null
}
